{
	"fa_type": "dfa",
	"states": ["1", "2"],
	"input_symbols": ["a", "b", "c", "d", "e", "f"],
	"transitions": {
		"1": {"a": "2", "b": "2", "c": "1", "d": "2", "e": "1", "f": "2"},
		"2": {"a": "2", "b": "1", "c": "2", "d": "1", "e": "2", "f": "1"}
	},
	"initial_state": "1",
	"final_states": ["2"]
}