{
	"fa_type": "dfa",
	"states": ["1", "2", "3", "4", "5", "6", "7", "8", "9", "10", "11", "12", "13", "14", "15"],
	"input_symbols": ["a"],
	"transitions": {
		"1": {"a": "2"},
		"2": {"a": "3"},
		"3": {"a": "4"},
		"4": {"a": "5"},
        "5": {"a": "6"},
        "6": {"a": "7"},
        "7": {"a": "8"},
        "8": {"a": "9"},
        "9": {"a": "10"},
        "10": {"a": "11"},
        "11": {"a": "12"},
        "12": {"a": "13"},
        "13": {"a": "14"},
        "14": {"a": "15"},
        "15": {"a": "1"}
	},
	"initial_state": "1",
	"final_states": ["15"]
}
